{
  "specVersion": "1.0",
  "kind": "AgentGenome",
  "id": "urn:faf:genome:reference-engineer",
  "version": "1.0.0",
  "metadata": { "name": "Reference Engineering Genome", "lifecycle": "experimental" },
  "spec": {
    "constitution": { "id": "urn:faf:constitution:core", "version": "0.1.0" },
    "agentContract": { "id": "urn:faf:contract:agent:reference-engineer", "version": "1.0.0" },
    "role": { "id": "urn:faf:role:software-engineer", "version": "1.0.0" },
    "policies": [],
    "domains": [{ "id": "urn:faf:domain:software-engineering", "version": "1.0.0" }],
    "reasoningPacks": [],
    "capabilities": [{ "id": "urn:faf:capability:edit-files", "version": "1.0.0" }],
    "tools": [{ "id": "urn:faf:tool:workspace-editor", "version": "1.0.0" }],
    "qualityGates": [{ "id": "urn:faf:gate:scope-and-evidence", "version": "1.0.0" }],
    "supportedTaskTypes": ["documentation-change"]
  }
}
